{
  "$schema": "https://json-schema.org/draft/2020-12/schema",
  "$id": "https://github.com/Wasif-ZA/DynamicSolver/contract/packing-response.schema.json",
  "title": "Packing response",
  "description": "The packing plan: which physical boxes to use, and where every unit sits inside them. Positions are the corner nearest the origin, and sizes are AS PLACED with rotation already applied, so a consumer can render each placement as a cuboid with no further maths.",
  "type": "object",
  "required": ["requestId", "status", "containers", "unpacked"],
  "additionalProperties": false,
  "properties": {
    "requestId": {
      "type": "string",
      "description": "Copied from the request, unchanged."
    },
    "status": {
      "enum": ["solved", "partial", "rejected"],
      "description": "solved: every unit placed. partial: some placed, some not. rejected: nothing placed. Derived from unpacked and containers, never set independently."
    },
    "mode": {
      "enum": ["standard", "fluid", "own_packaging"],
      "description": "The mode actually used."
    },
    "containers": {
      "type": "array",
      "description": "One entry per PHYSICAL box used. Two uses of the same box type appear as two entries.",
      "items": { "$ref": "#/$defs/container" }
    },
    "unpacked": {
      "type": "array",
      "description": "Units that could not be placed, each with a machine-readable reason. Empty when status is solved.",
      "items": { "$ref": "#/$defs/unpackedUnit" }
    },
    "metrics": { "$ref": "#/$defs/metrics" },
    "warnings": {
      "type": "array",
      "items": { "type": "string" },
      "description": "Non-fatal notes for humans, for example a keepTogether preference the solver had to break."
    }
  },
  "$defs": {
    "dimensions": {
      "type": "object",
      "required": ["width", "height", "depth"],
      "additionalProperties": false,
      "properties": {
        "width": { "type": "integer", "exclusiveMinimum": 0 },
        "height": { "type": "integer", "exclusiveMinimum": 0 },
        "depth": { "type": "integer", "exclusiveMinimum": 0 }
      }
    },
    "position": {
      "type": "object",
      "required": ["x", "y", "z"],
      "additionalProperties": false,
      "description": "Corner of the item nearest the origin, in millimetres. Origin is the inside bottom-left-back corner of the box. Never a centre point.",
      "properties": {
        "x": { "type": "integer", "minimum": 0 },
        "y": { "type": "integer", "minimum": 0 },
        "z": { "type": "integer", "minimum": 0 }
      }
    },
    "container": {
      "type": "object",
      "required": ["instanceId", "boxId", "interior", "placements"],
      "additionalProperties": false,
      "properties": {
        "instanceId": {
          "type": "string",
          "description": "Unique per physical box in this response, for example B-SMALL#1 and B-SMALL#2."
        },
        "boxId": {
          "type": "string",
          "description": "The box type from the request this was drawn from."
        },
        "name": { "type": "string", "description": "Box type's human label, copied through." },
        "interior": {
          "$ref": "#/$defs/dimensions",
          "description": "Copied from the box type. Repeated here so a consumer can render a container without cross-referencing the request."
        },
        "placements": {
          "type": "array",
          "items": { "$ref": "#/$defs/placement" }
        },
        "utilisation": { "$ref": "#/$defs/utilisation" }
      }
    },
    "placement": {
      "type": "object",
      "required": ["step", "itemId", "unit", "position", "size"],
      "additionalProperties": false,
      "properties": {
        "step": {
          "type": "integer",
          "exclusiveMinimum": 0,
          "description": "GLOBAL 1-based pack order across the whole response, not per container. Sort every placement by step and reveal one at a time to drive the step-by-step view."
        },
        "itemId": { "type": "string", "description": "The item line from the request." },
        "unit": {
          "type": "integer",
          "exclusiveMinimum": 0,
          "description": "Which unit of that line this is, 1-based. A line with quantity 3 produces units 1, 2 and 3."
        },
        "reference": { "type": "string", "description": "SKU, copied through for display and scanning." },
        "name": { "type": "string", "description": "Human label, copied through." },
        "position": { "$ref": "#/$defs/position" },
        "size": {
          "$ref": "#/$defs/dimensions",
          "description": "Dimensions AS PLACED, with rotation already applied. Draw a cuboid of this size at position and you are done. This will differ from the request size when rotation is not WHD."
        },
        "rotation": {
          "enum": ["WHD", "WDH", "HWD", "HDW", "DWH", "DHW"],
          "default": "WHD",
          "description": "How the item's original width, height and depth map onto the placed x, y and z axes. WHD is unrotated. Informational only: size already reflects it, so a renderer can ignore this field."
        }
      }
    },
    "unpackedUnit": {
      "type": "object",
      "required": ["itemId", "unit", "reason"],
      "additionalProperties": false,
      "properties": {
        "itemId": { "type": "string" },
        "unit": { "type": "integer", "exclusiveMinimum": 0 },
        "reference": { "type": "string" },
        "reason": {
          "enum": ["NO_BOX_FITS", "INCOMPATIBLE", "EXCEEDS_WEIGHT"],
          "description": "NO_BOX_FITS: larger than the interior of every box type. INCOMPATIBLE: group rules bar it from every box it could have shared. EXCEEDS_WEIGHT: fits by volume but would breach a weight limit."
        },
        "detail": {
          "type": "string",
          "description": "Human-readable explanation for the portal to surface to a packer."
        }
      }
    },
    "utilisation": {
      "type": "object",
      "additionalProperties": false,
      "description": "How full this container is. Volumes in cubic millimetres, weights in grams.",
      "properties": {
        "volumeUsed": { "type": "integer", "minimum": 0 },
        "volumeTotal": { "type": "integer", "exclusiveMinimum": 0 },
        "volumeRatio": { "type": "number", "minimum": 0, "maximum": 1 },
        "weightUsed": {
          "type": "integer",
          "minimum": 0,
          "description": "Gross: contents plus the box's own tare weight."
        },
        "weightLimit": { "type": ["integer", "null"], "minimum": 0 }
      }
    },
    "metrics": {
      "type": "object",
      "additionalProperties": false,
      "properties": {
        "solveTimeMs": {
          "type": "integer",
          "minimum": 0,
          "description": "Wall-clock time inside the solver. The client's bar is 1000 to 2000 ms for a single order."
        },
        "containerCount": { "type": "integer", "minimum": 0 },
        "volumeUtilisation": {
          "type": "number",
          "minimum": 0,
          "maximum": 1,
          "description": "Across all containers. Our headline efficiency number."
        },
        "algorithm": {
          "type": "string",
          "description": "Which strategy produced this, for example first-fit-decreasing. Lets us compare approaches on the same input."
        }
      }
    }
  }
}
